{
 "capture": "default",
 "config_hash": "ea1e5460b844566f",
 "end_utc": "2026-09-13T16:27:07+00:00",
 "energy_kwh": 0.0,
 "experiment_id": "N9",
 "kill_criterion": null,
 "kill_verdict": null,
 "qicert_version": "0.1.0.dev0",
 "results": {
  "acc_post": 0.45185324908044894,
  "acc_pre": 0.15863434876921625,
  "calib_stat": "absmax",
  "cert_sound_layers": 168,
  "compress_wall_sec": 648.2,
  "delta_repair": 0.2932,
  "delta_vs_n1_ft": 0.0051,
  "eval_scope": "frozen-split prefix (600 batches, 10603 tokens)",
  "frac": 0.5,
  "lora_delta_spectral_max": 4.858443,
  "lora_r": 8,
  "lr": 0.0005,
  "n1_ft": 0.44677153113182005,
  "n_layers_compressed": 168,
  "n_layers_kept_full": 0,
  "ratio": 2.536,
  "residual_rank_cap": 64,
  "seed": 0,
  "steps": 1200,
  "train_wall_sec": 474.3
 },
 "run_id": "80fd4bcd0832",
 "run_tag": "repair-frac0.500-rr64-seed0",
 "seed": 0,
 "seed_spec": {
  "numpy": 0,
  "python": 0,
  "torch": 0
 },
 "start_utc": "2026-09-13T16:04:00+00:00",
 "status": "completed",
 "tolerance_note": null,
 "wall_sec": 1387.29
}