{
 "capture": "default",
 "config_hash": "93042cf94a78e81c",
 "end_utc": "2026-09-13T12:49:43+00:00",
 "energy_kwh": 0.0,
 "experiment_id": "N2R2",
 "kill_criterion": null,
 "kill_verdict": null,
 "qicert_version": "0.1.0.dev0",
 "results": {
  "backbone": "TT",
  "calib_stat": "absmax",
  "cert_sound_layers": 168,
  "ci_hi": null,
  "ci_lo": null,
  "correct": 86,
  "delta_vs_n1_ft": -0.3246,
  "eval_acc": 0.12215909090909091,
  "eval_scope": "search-prefix (40 batches, 704 tokens)",
  "fit_mode": "weighted",
  "matched_batch": true,
  "mixed_allocation": false,
  "n_eval_batches": null,
  "n_layers_compressed": 168,
  "n_layers_kept_full": 0,
  "plan_fraction": 0.5,
  "ratio": 2.536,
  "residual_rank_cap": 64,
  "seed": 0,
  "total": 704,
  "wall_sec": 645.02
 },
 "run_id": "5d38ade72a62",
 "run_tag": "n2r2-weighted-0.500-rr64-seed0",
 "seed": 0,
 "seed_spec": {
  "numpy": 0,
  "python": 0,
  "torch": 0
 },
 "start_utc": "2026-09-13T12:49:42+00:00",
 "status": "completed",
 "tolerance_note": null,
 "wall_sec": 1.08
}