{
 "capture": "default",
 "config_hash": "6161c6c33d47cf7d",
 "experiment_id": "E7-int8-ablation",
 "qicert_version": "0.1.0.dev0",
 "run_id": "43a27b79c4a4",
 "run_tag": "subset-ablation",
 "seed": 0,
 "seed_spec": {
  "numpy": 0,
  "python": 0,
  "torch": 0
 },
 "start_utc": "2026-08-25T17:45:47+00:00",
 "status": "running"
}