{
 "capture": "default",
 "config_hash": "030a78f95194fdc4",
 "experiment_id": "N1v2",
 "qicert_version": "0.1.0.dev0",
 "run_id": "07c3e2a4ca61",
 "run_tag": "baseline-seed0",
 "seed": 0,
 "seed_spec": {
  "numpy": 0,
  "python": 0,
  "torch": 0
 },
 "start_utc": "2026-09-11T10:58:35+00:00",
 "status": "running"
}