{
 "capture": "default",
 "config_hash": "e1192afc58b52e5e",
 "experiment_id": "N1v2-seed1",
 "qicert_version": "0.1.0.dev0",
 "run_id": "aafcafe5a6e4",
 "run_tag": "baseline-seed0",
 "seed": 0,
 "seed_spec": {
  "numpy": 0,
  "python": 0,
  "torch": 0
 },
 "start_utc": "2026-09-11T16:54:35+00:00",
 "status": "running"
}