{
 "capture": "default",
 "config_hash": "87a5187fc2008de3",
 "experiment_id": "N1v2-seed2",
 "qicert_version": "0.1.0.dev0",
 "run_id": "99b8e42f3109",
 "run_tag": "baseline-seed0",
 "seed": 0,
 "seed_spec": {
  "numpy": 0,
  "python": 0,
  "torch": 0
 },
 "start_utc": "2026-09-11T16:54:36+00:00",
 "status": "running"
}