{
 "capture": "default",
 "config_hash": "8f9d022f9ee5bc88",
 "end_utc": "2026-09-13T13:41:45+00:00",
 "energy_kwh": 0.0,
 "experiment_id": "N2R2",
 "kill_criterion": null,
 "kill_verdict": null,
 "qicert_version": "0.1.0.dev0",
 "results": {
  "backbone": "TT",
  "calib_stat": "absmax",
  "cert_sound_layers": 168,
  "ci_hi": 0.16618667134223097,
  "ci_lo": 0.16189686918206242,
  "correct": 18781,
  "delta_vs_n1_ft": -0.2827,
  "eval_acc": 0.16403049861568425,
  "eval_scope": "full-split (6496 batches, 114497 tokens)",
  "fit_mode": "weighted",
  "matched_batch": true,
  "mixed_allocation": false,
  "n_eval_batches": 6496,
  "n_layers_compressed": 168,
  "n_layers_kept_full": 0,
  "plan_fraction": 0.5,
  "ratio": 2.536,
  "residual_rank_cap": 64,
  "seed": 0,
  "total": 114497,
  "wall_sec": 0.0
 },
 "run_id": "b62c096dba55",
 "run_tag": "n2r2-weighted-0.500-rr64-seed0",
 "seed": 0,
 "seed_spec": {
  "numpy": 0,
  "python": 0,
  "torch": 0
 },
 "start_utc": "2026-09-13T13:41:43+00:00",
 "status": "completed",
 "tolerance_note": null,
 "wall_sec": 1.47
}