{
 "capture": "default",
 "config_hash": "6db74730f6625750",
 "end_utc": "2026-09-13T12:38:54+00:00",
 "energy_kwh": 0.0,
 "experiment_id": "N2R2",
 "kill_criterion": null,
 "kill_verdict": null,
 "qicert_version": "0.1.0.dev0",
 "results": {
  "agreement": 0.5852272727272727,
  "compressed_layers": 168,
  "config": {
   "calib_stat": "absmax",
   "fit_mode": "weighted",
   "keep_types": [],
   "mixed_allocation": false,
   "plan_fraction": 0.5,
   "reason": "weighted repair, moderate residual cap, no mixed (search baseline)",
   "residual_rank_cap": 32,
   "tt_split": 0.6
  },
  "correct": 86,
  "eval_scope": "search-prefix (40 batches, 704 tokens)",
  "kept_full_layers": 0,
  "n_batches_used": 40,
  "provisional_go": false,
  "ratio": 2.861,
  "ref_tokens": 704,
  "search_acc": 0.12215909090909091,
  "seed": 0,
  "sound_layers": 168,
  "total": 704,
  "wall_sec": 628.89
 },
 "run_id": "b8b643b05364",
 "run_tag": "search-0_weighted_frac0.50_rr32",
 "seed": 0,
 "seed_spec": {
  "numpy": 0,
  "python": 0,
  "torch": 0
 },
 "start_utc": "2026-09-13T12:38:52+00:00",
 "status": "completed",
 "tolerance_note": null,
 "wall_sec": 1.7
}